Customer ID,Age,Gender,Item Purchased,Category,Purchase Amount (USD),Location,Size,Color,Season,Review Rating,Subscription Status,Shipping Type,Discount Applied,Promo Code Used,Previous Purchases,Payment Method,Frequency of Purchases,user id,Interaction type,Date,Time,Product Name,Is Amazon Seller
2226.0,38.0,Male,Belt,Accessories,64.0,Washington,S,Olive,Spring,4.8,No,Free Shipping,0,No,18.0,Credit Card,Annually,2226.0,view,2023-05-25,10:00:00,"ST Racing Concepts ST5475LB CNC Machined Aluminum 4mm/5mm Turnbuckle Wrench, Blue",Y
2227.0,22.0,Male,Shirt,Clothing,72.0,Missouri,L,Blue,Spring,4.8,No,Store Pickup,0,No,28.0,Cash,Annually,2227.0,like,2023-05-26,10:00:00,"Nerf N Strike Elite Strongarm Toy Blaster with Rotating Barrel, Slam Fire, and 6 Official Nerf Elite Darts for Kids, Teens, & Adults(Amazon Exclusive)",Y
2228.0,40.0,Male,Scarf,Accessories,74.0,Washington,S,Gray,Summer,4.4,No,Next Day Air,0,No,42.0,Credit Card,Fortnightly,2228.0,purchase,2023-05-27,10:00:00,"Ravensburger 07834, Mermaid Adventures 2 x 24 Piece Puzzles in a Box, 2 x 24 Piece Puzzles for Kids, Every Piece is Unique, Pieces Fit Together Perfectly",Y
2229.0,54.0,Male,Gloves,Accessories,50.0,Kansas,M,Green,Fall,3.7,No,Free Shipping,0,No,5.0,Credit Card,Weekly,2229.0,purchase,2023-05-28,10:00:00,Funko Pop: Toy Story - Wheezy,Y
2230.0,70.0,Male,Pants,Clothing,97.0,Minnesota,M,Silver,Fall,3.9,No,Express,0,No,50.0,Venmo,Monthly,2230.0,view,2023-05-29,10:00:00,DC Designer Series: Black Label Batman by Lee Bermejo Statue,Y
2231.0,52.0,Male,Sneakers,Footwear,36.0,Colorado,S,Teal,Spring,3.8,No,Express,0,No,33.0,Venmo,Fortnightly,2231.0,like,2023-05-30,10:00:00,Boy's Green Lantern Costume,Y
2232.0,34.0,Male,Jacket,Outerwear,49.0,Utah,M,Beige,Fall,4.1,No,Store Pickup,0,No,1.0,Credit Card,Weekly,2232.0,view,2023-05-31,10:00:00,Name Stampers Arianna Rubber Stamps,Y
2233.0,65.0,Male,Shoes,Footwear,64.0,North Carolina,L,Lavender,Spring,4.0,No,Store Pickup,0,No,14.0,Cash,Fortnightly,2233.0,like,2023-06-01,10:00:00,"Funko Pop! - Funkoverse Strategy Game: Rick & Morty #100 - Expandalone, Multicolor",Y
2234.0,38.0,Male,Blouse,Clothing,31.0,Florida,XL,Gray,Summer,4.5,No,Express,0,No,48.0,Credit Card,Monthly,2234.0,like,2023-06-02,10:00:00,Nickelodeon Paw Patrol Toddler Knee & Elbow Pad,Y
2235.0,35.0,Male,Boots,Footwear,66.0,New Hampshire,S,Yellow,Winter,4.0,No,Express,0,No,26.0,Cash,Weekly,2235.0,purchase,2023-06-03,10:00:00,"American Greetings, My Little Pony Party Tiaras, 8-Count",Y
2236.0,40.0,Male,Socks,Clothing,82.0,Illinois,M,Gray,Spring,4.5,No,2-Day Shipping,0,No,44.0,Credit Card,Annually,2236.0,view,2023-06-04,10:00:00,"My Beautiful Girl 18"" Dolls (Parisian Style)",Y
2237.0,23.0,Male,T-shirt,Clothing,88.0,Louisiana,M,Yellow,Winter,2.7,No,Standard,0,No,18.0,Debit Card,Fortnightly,2237.0,like,2023-06-05,10:00:00,RWBY Weiss Schnee Collectible Figure,Y
2238.0,45.0,Male,Sandals,Footwear,34.0,Alabama,S,Black,Summer,3.8,No,Next Day Air,0,No,31.0,Venmo,Every 3 Months,2238.0,purchase,2023-06-06,10:00:00,"Phoenix Home Espresso Collection Kid's Toy Storage Organizer with 12 Plastic Bins, White",Y
2239.0,40.0,Male,Sneakers,Footwear,84.0,Florida,L,Beige,Winter,3.8,No,Standard,0,No,18.0,Debit Card,Weekly,2239.0,purchase,2023-06-07,10:00:00,Rubie's Women's Batman v Superman: Dawn of Justice Wonder Woman Costume Top,Y
2240.0,42.0,Male,Jewelry,Accessories,96.0,Alabama,L,Indigo,Summer,3.8,No,2-Day Shipping,0,No,41.0,Credit Card,Every 3 Months,2240.0,view,2023-06-08,10:00:00,Fantasy Flight Games The Ghost of Framsburg Adventure Pack,Y
2241.0,57.0,Male,Sandals,Footwear,71.0,California,L,Green,Winter,4.3,No,Next Day Air,0,No,18.0,Debit Card,Every 3 Months,2241.0,like,2023-06-09,10:00:00,UNO: Emoji - Card Game,Y
2242.0,18.0,Male,Jacket,Outerwear,77.0,Maryland,M,Purple,Summer,3.5,No,Free Shipping,0,No,3.0,Bank Transfer,Bi-Weekly,2242.0,view,2023-06-10,10:00:00,Disney Rose Gold Minnie Classic Toddler Girls' Costume,Y
2243.0,18.0,Male,Skirt,Clothing,66.0,Nevada,M,Orange,Spring,3.8,No,Next Day Air,0,No,5.0,Credit Card,Bi-Weekly,2243.0,like,2023-06-11,10:00:00,Kaiyodo Revoltech: Evangelion Evolution EV-018 Custom Type-08 Flash Version Action Figure,Y
2244.0,56.0,Male,Shirt,Clothing,21.0,Massachusetts,M,Teal,Winter,3.7,No,2-Day Shipping,0,No,13.0,Debit Card,Annually,2244.0,like,2023-06-12,10:00:00,EuroGraphics San Antonio River Walk Puzzle (1000-Piece),Y
2245.0,35.0,Male,Shorts,Clothing,37.0,South Carolina,M,Gold,Summer,4.8,No,2-Day Shipping,0,No,22.0,PayPal,Annually,2245.0,purchase,2023-06-13,10:00:00,"Clementoni ""Las Vegas Puzzle (2000 Piece)",Y
2246.0,49.0,Male,Socks,Clothing,90.0,Delaware,L,Gray,Fall,4.9,No,Free Shipping,0,No,45.0,PayPal,Fortnightly,2246.0,view,2023-06-14,10:00:00,Funko Pop! Movies: Us - Pluto with Mask (Styles May Vary),Y
2247.0,49.0,Male,Jacket,Outerwear,96.0,Hawaii,M,Cyan,Fall,4.3,No,Store Pickup,0,No,39.0,PayPal,Every 3 Months,2247.0,like,2023-06-15,10:00:00,Jolly Jumper Bath Tub Toy Bag,Y
2248.0,34.0,Male,Jewelry,Accessories,37.0,Florida,L,Teal,Summer,4.4,No,Next Day Air,0,No,18.0,Venmo,Annually,2248.0,purchase,2023-06-16,10:00:00,Art In History EDU104 Hands-On History Civil War Face Jug,Y
2249.0,63.0,Male,T-shirt,Clothing,66.0,Rhode Island,M,Violet,Winter,3.4,No,Free Shipping,0,No,19.0,PayPal,Fortnightly,2249.0,purchase,2023-06-17,10:00:00,Blade Landing Gear w/ Hardware White: 200 SR X,Y
2250.0,42.0,Male,Gloves,Accessories,45.0,Wyoming,XL,Indigo,Spring,4.3,No,Next Day Air,0,No,29.0,Debit Card,Weekly,2250.0,view,2023-06-18,10:00:00,UNOcorns Card Game,Y
2251.0,41.0,Male,Shoes,Footwear,89.0,Colorado,L,Pink,Summer,4.6,No,Store Pickup,0,No,19.0,Credit Card,Weekly,2251.0,like,2023-06-19,10:00:00,Watchover Voodoo Blossom Voodoo Novelty,Y
2252.0,26.0,Male,Shoes,Footwear,94.0,Virginia,L,Gold,Fall,3.8,No,Free Shipping,0,No,22.0,Debit Card,Monthly,2252.0,view,2023-06-20,10:00:00,Winning Moves Games Triple Cross,Y
2253.0,48.0,Male,Shoes,Footwear,96.0,Nebraska,S,Maroon,Summer,3.9,No,Express,0,No,21.0,Bank Transfer,Annually,2253.0,like,2023-06-21,10:00:00,The Learning Journey: Match It! - Numbers - Self-Correcting Number & Counting Puzzles,Y
2254.0,62.0,Male,Hoodie,Clothing,31.0,Oklahoma,M,Brown,Spring,2.6,No,Store Pickup,0,No,22.0,PayPal,Monthly,2254.0,like,2023-06-22,10:00:00,Star Wars LCG: Meditation and Mastery,Y
2255.0,24.0,Male,Belt,Accessories,79.0,North Dakota,M,Gold,Winter,4.2,No,Store Pickup,0,No,44.0,PayPal,Every 3 Months,2255.0,purchase,2023-06-23,10:00:00,PLAYMOBIL Picnic with Pony Wagon,Y
2256.0,48.0,Male,Coat,Outerwear,39.0,Michigan,L,Teal,Spring,4.6,No,Store Pickup,0,No,42.0,Bank Transfer,Quarterly,2256.0,view,2023-06-24,10:00:00,"Franco Bedding Super Soft Plush Kids Weighted Blanket with Bonus Door Knob Pillow, 36"" x 48” 4.5lbs, Disney Frozen 2",Y
2257.0,31.0,Male,Blouse,Clothing,22.0,California,M,Turquoise,Fall,5.0,No,Standard,0,No,33.0,Credit Card,Quarterly,2257.0,like,2023-06-25,10:00:00,Disguise Rapunzel Classic Child Tiara-,Y
2258.0,41.0,Male,Skirt,Clothing,32.0,Tennessee,L,Olive,Fall,4.2,No,Standard,0,No,6.0,Bank Transfer,Annually,2258.0,purchase,2023-06-26,10:00:00,Funko Royal Family Series Collectors Set,Y
2259.0,24.0,Male,T-shirt,Clothing,71.0,Ohio,L,Cyan,Winter,4.3,No,Store Pickup,0,No,44.0,Credit Card,Every 3 Months,2259.0,purchase,2023-06-27,10:00:00,Winning Moves Games Classic Ouija,Y
2260.0,60.0,Male,Jeans,Clothing,96.0,Florida,XL,Beige,Spring,3.3,No,Free Shipping,0,No,24.0,Cash,Annually,2260.0,view,2023-06-28,10:00:00,The Tin Box Company Batman Head Shape Tin Carry All,Y
2261.0,38.0,Male,Scarf,Accessories,82.0,Missouri,M,Blue,Fall,4.9,No,Express,0,No,16.0,PayPal,Quarterly,2261.0,like,2023-06-29,10:00:00,LEC Battery Operated Train Accessory - Track No. 19 Straight Elevated Train Track Brown - 8 Pieces,Y
2262.0,58.0,Male,Backpack,Accessories,76.0,South Carolina,L,Gold,Spring,4.4,No,Standard,0,No,12.0,Bank Transfer,Fortnightly,2262.0,view,2023-06-30,10:00:00,WWE Massive Belt Banners - Airnormous WWE United States Championship Title,Y
2263.0,53.0,Male,Backpack,Accessories,22.0,Arizona,M,Green,Winter,3.1,No,2-Day Shipping,0,No,50.0,PayPal,Monthly,2263.0,like,2023-07-01,10:00:00,DC Collectibles DC Comics Blueline Wonder Woman by Jim Lee Action Figure,Y
2264.0,44.0,Male,Scarf,Accessories,40.0,Indiana,XL,Green,Winter,3.5,No,Store Pickup,0,No,42.0,Cash,Quarterly,2264.0,like,2023-07-02,10:00:00,Hitec RCD 36625 D-625MW 32-Bit High Speed Metal Gear Servo,Y
2265.0,51.0,Male,Hat,Accessories,92.0,North Dakota,M,Turquoise,Summer,3.9,No,2-Day Shipping,0,No,50.0,PayPal,Monthly,2265.0,purchase,2023-07-03,10:00:00,Decopac Angry Birds Red Bird and Bad Piggy DecoSet Cake Decoration,Y
2266.0,36.0,Male,Coat,Outerwear,94.0,Montana,XL,Yellow,Fall,3.9,No,Store Pickup,0,No,10.0,PayPal,Quarterly,2266.0,view,2023-07-04,10:00:00,Rubie's Costume Co - Girls Gypsy Costume,Y
2267.0,20.0,Male,Dress,Clothing,44.0,Missouri,M,Yellow,Fall,4.3,No,Store Pickup,0,No,32.0,Debit Card,Weekly,2267.0,like,2023-07-05,10:00:00,"American Girl Crafts Bedroom Personalized Banner Decoration for Girls, 153pc",Y
2268.0,32.0,Male,Gloves,Accessories,49.0,Kentucky,S,Blue,Spring,3.8,No,Express,0,No,37.0,Venmo,Weekly,2268.0,purchase,2023-07-06,10:00:00,Quercetti Tubation Wheels,Y
2269.0,66.0,Male,Sweater,Clothing,26.0,Georgia,L,Charcoal,Spring,2.7,No,2-Day Shipping,0,No,15.0,Bank Transfer,Monthly,2269.0,like,2023-07-07,10:00:00,LEGO Classic World Fun 10403 Building Kit (295 Piece),Y
2270.0,49.0,Male,Skirt,Clothing,38.0,Kentucky,M,Yellow,Fall,4.4,No,Store Pickup,0,No,27.0,Credit Card,Annually,2270.0,like,2023-07-08,10:00:00,"Safari Ltd Wild TOOB With 12 Great Jungle Friends, Including a Giraffe, Brown Bear, Tiger, Camel, Lion, Crocodile, Gorilla, Hippo, Rhino, Zebra, Panther and Elephant (Discontinued by manufacturer)",Y
2271.0,27.0,Male,Blouse,Clothing,72.0,Georgia,L,Purple,Spring,3.5,No,Express,0,No,7.0,Venmo,Weekly,2271.0,purchase,2023-07-09,10:00:00,Good Smile Nendoroid Ichigo Kurosaki,Y
2272.0,29.0,Male,Dress,Clothing,99.0,Alaska,M,Green,Summer,3.4,No,Free Shipping,0,No,49.0,PayPal,Quarterly,2272.0,view,2023-07-10,10:00:00,"Bumkins Junior Bib / Short Sleeve Toddler Bib / Smock 1-3 Years, Waterproof, Washable, Stain and Odor Resistant – Bloom",Y
2273.0,29.0,Male,Jacket,Outerwear,38.0,Maine,L,Charcoal,Spring,4.0,No,Standard,0,No,44.0,PayPal,Monthly,2273.0,like,2023-07-11,10:00:00,Crafty Dab Kids Paints - Set of 10 - Assorted Colors - Scented,Y
2274.0,55.0,Male,Coat,Outerwear,96.0,New Mexico,L,Silver,Winter,4.8,No,Express,0,No,13.0,PayPal,Bi-Weekly,2274.0,view,2023-07-12,10:00:00,Gorilla Playsets 09-1014-US American Flag Swing Set Accessory with Mounting Hardware,Y
2275.0,57.0,Male,Dress,Clothing,27.0,New York,L,Turquoise,Spring,4.5,No,Next Day Air,0,No,38.0,PayPal,Fortnightly,2275.0,like,2023-07-13,10:00:00,"NATIONAL GEOGRAPHIC Rocks & Fossils Kit – 200 Piece Set Includes Geodes, Real Fossils, Rose Quartz, Jasper, Aventurine, & Many More Rocks, Crystals & Gemstones",Y
2276.0,29.0,Male,Shorts,Clothing,24.0,Oklahoma,M,Gray,Winter,4.4,No,Standard,0,No,10.0,Debit Card,Weekly,2276.0,like,2023-07-14,10:00:00,"Funko Galactic Plush: Rick & Morty - Tinkles Collectible Figure, Multicolor",Y
2277.0,31.0,Male,Jeans,Clothing,82.0,Wyoming,L,Red,Summer,4.1,No,2-Day Shipping,0,No,25.0,Debit Card,Weekly,2277.0,purchase,2023-07-15,10:00:00,"Melissa & Doug Shake It! Deluxe Pets Beginner Craft Kit (Confetti-Covered Cat, Dog, and Bunny, 4” x 1.5” Each, Great Gift for Girls and Boys - Best for 3, 4, 5, and 6 Year Olds)",Y
2278.0,25.0,Male,Hat,Accessories,56.0,Alabama,M,Beige,Summer,4.6,No,Next Day Air,0,No,18.0,Credit Card,Quarterly,2278.0,view,2023-07-16,10:00:00,"Sun-Staches Star Wars Storm Trooper Officially Licensed, White, Black",Y
2279.0,61.0,Male,Gloves,Accessories,25.0,Maryland,M,Maroon,Fall,3.8,No,Store Pickup,0,No,6.0,Cash,Every 3 Months,2279.0,like,2023-07-17,10:00:00,"Fisher-Price Nickelodeon Shimmer & Shine, Teenie Genies, Collect & Carry Genie Case",Y
2280.0,53.0,Male,Sneakers,Footwear,67.0,West Virginia,L,Indigo,Spring,2.9,No,Free Shipping,0,No,35.0,Bank Transfer,Quarterly,2280.0,purchase,2023-07-18,10:00:00,"Scrapbook Customs Themed Paper and Stickers Scrapbook Kit, Bali Paradise",Y
2281.0,22.0,Male,Shoes,Footwear,21.0,Kentucky,M,Red,Summer,2.8,No,Standard,0,No,31.0,Credit Card,Fortnightly,2281.0,purchase,2023-07-19,10:00:00,Areaware Blockitecture Garden City Mega Set,Y
2282.0,28.0,Male,Hoodie,Clothing,27.0,Kansas,XL,Maroon,Summer,3.0,No,Store Pickup,0,No,41.0,Bank Transfer,Annually,2282.0,view,2023-07-20,10:00:00,Revell 1/25 '85 Oldsmobile 442/FE3-X Show Car Plastic Model Kit,Y
2283.0,18.0,Male,Sneakers,Footwear,97.0,Idaho,S,Red,Fall,4.2,No,2-Day Shipping,0,No,8.0,Credit Card,Annually,2283.0,like,2023-07-21,10:00:00,DIAMOND SELECT TOYS Marvel Comic Gallery: Squirrel Girl PVC Diorama Figure,Y
2284.0,44.0,Male,Handbag,Accessories,45.0,Ohio,S,Black,Winter,4.1,No,Free Shipping,0,No,34.0,Credit Card,Fortnightly,2284.0,view,2023-07-22,10:00:00,"White Mountain Puzzles First Kiss Jigsaw Puzzle, Multicolor",Y
2285.0,32.0,Male,Blouse,Clothing,63.0,Iowa,XL,Black,Fall,4.1,No,Express,0,No,20.0,Venmo,Annually,2285.0,like,2023-07-23,10:00:00,Fantasy Flight Games Emerald Empire: The Essential Guide to Rokugan,Y
2286.0,34.0,Male,Belt,Accessories,100.0,Michigan,L,Pink,Summer,4.6,No,2-Day Shipping,0,No,38.0,PayPal,Every 3 Months,2286.0,purchase,2023-07-24,10:00:00,Burton & Burton Inflatable Happy New Years Frame Photo Prop,Y
2287.0,67.0,Male,Socks,Clothing,38.0,South Dakota,L,Blue,Spring,2.5,No,Store Pickup,0,No,35.0,Venmo,Quarterly,2287.0,view,2023-07-25,10:00:00,Creative LEGO Brick Set by LEGO Education,Y
2288.0,66.0,Male,Blouse,Clothing,45.0,Nebraska,L,Green,Summer,3.0,No,Store Pickup,0,No,6.0,Debit Card,Annually,2288.0,like,2023-07-26,10:00:00,"NJ Croce AB5002 Action Bendables Superman, Figure, 4"", Multicolor",Y
2289.0,28.0,Male,Jewelry,Accessories,91.0,California,M,Orange,Fall,3.8,No,Next Day Air,0,No,50.0,PayPal,Weekly,2289.0,view,2023-07-27,10:00:00,Bachmann Celebration Thomas Locomotive with Moving Eyes Train,Y
2290.0,70.0,Male,Shorts,Clothing,82.0,Nevada,M,Orange,Fall,4.1,No,Free Shipping,0,No,47.0,Venmo,Weekly,2290.0,like,2023-07-28,10:00:00,"Manhattan Toy Baby Stella Stay Wild Baby Doll Clothes for 15"" Soft Baby Dolls",Y
2291.0,37.0,Male,Boots,Footwear,48.0,Kansas,L,Magenta,Winter,3.3,No,Standard,0,No,23.0,PayPal,Quarterly,2291.0,like,2023-07-29,10:00:00,"Maisto 31197Rd 1: 18 Special Edition 2015 Ford Mustang Die-Cast Vehicles, Red",Y
2292.0,28.0,Male,Coat,Outerwear,30.0,Ohio,M,Indigo,Spring,5.0,No,2-Day Shipping,0,No,13.0,Credit Card,Quarterly,2292.0,purchase,2023-07-30,10:00:00,Ubbi Squeeze and Switch Silicone Mold Free Bath Toys for Toddlers and Baby,Y
2293.0,43.0,Male,T-shirt,Clothing,34.0,Vermont,S,Beige,Spring,3.8,No,Next Day Air,0,No,31.0,Debit Card,Monthly,2293.0,view,2023-07-31,10:00:00,Disney Baymax Soft Touch PVC Key Holder,Y
2294.0,37.0,Male,Sweater,Clothing,68.0,Georgia,L,Green,Fall,3.3,No,Express,0,No,16.0,Debit Card,Every 3 Months,2294.0,like,2023-08-01,10:00:00,"Vallejo Acrylic Paint, Orange Red",Y
2295.0,54.0,Male,Sunglasses,Accessories,95.0,Maryland,M,Red,Winter,5.0,No,Express,0,No,40.0,Debit Card,Annually,2295.0,purchase,2023-08-02,10:00:00,"LEGO Technic Bugatti Chiron 42083 Race Car Building Kit and Engineering Toy, Adult Collectible Sports Car with Scale Model Engine (3599 Pieces)",N
2296.0,50.0,Male,Hat,Accessories,22.0,Connecticut,L,Beige,Spring,2.9,No,2-Day Shipping,0,No,45.0,PayPal,Quarterly,2296.0,purchase,2023-08-03,10:00:00,"amscan Hula Girl with Tissue Skirt Party Yard Sign, 23.5"" x 13""",Y
2297.0,46.0,Male,Gloves,Accessories,88.0,Washington,M,Green,Fall,2.5,No,Next Day Air,0,No,50.0,Venmo,Every 3 Months,2297.0,view,2023-08-04,10:00:00,Assorted Super Hero Comic Book Design Super Hi High Bounce Rubber Balls (12),Y
2298.0,60.0,Male,Socks,Clothing,83.0,California,M,Orange,Summer,4.7,No,Standard,0,No,1.0,Bank Transfer,Quarterly,2298.0,like,2023-08-05,10:00:00,"Gorilla Playsets 01-0006-AP Pioneer Peak Wood Swing Set with Wood Roof, Tire Swing, Clatter Bridge and Tower, Ramp, Slide, Two Swings, Amber",Y
2299.0,40.0,Male,Handbag,Accessories,87.0,Montana,L,Cyan,Spring,2.9,No,2-Day Shipping,0,No,10.0,Cash,Every 3 Months,2299.0,view,2023-08-06,10:00:00,"Razor E Prime Electric Scooter - Up to 15MPH, 8"" Airless Flat-free Tires, Rear Wheel Drive, 250W Brushless Hub Motor, Super Lightweight 21lbs, Anti-Rattle, Aluminum Folding Electric Scooter for Adults",Y
2300.0,64.0,Male,Coat,Outerwear,57.0,Idaho,M,Violet,Summer,3.7,No,Store Pickup,0,No,48.0,Credit Card,Every 3 Months,2300.0,like,2023-08-07,10:00:00,"Janod Chunky Puzzle Play Foods - 14-Piece Colorful Wooden Fruits & Vegetables Set - Encourages Shape Recognition, Dexterity, and Language Development - Preschool Kids and Toddlers 24 Months+",Y
2301.0,18.0,Male,Coat,Outerwear,88.0,Pennsylvania,XL,Lavender,Summer,4.4,No,2-Day Shipping,0,No,38.0,Credit Card,Monthly,2301.0,like,2023-08-08,10:00:00,Trends International Hatsune Miku - Standard 4 Sheet,Y
2302.0,37.0,Male,Pants,Clothing,20.0,Maine,L,Turquoise,Winter,2.9,No,Next Day Air,0,No,21.0,Debit Card,Annually,2302.0,purchase,2023-08-09,10:00:00,"Crayola 58-7726 Classic Fine Line Markers Assorted Colors 10 Count, 2 Pack",Y
2303.0,36.0,Male,Belt,Accessories,39.0,Montana,L,Pink,Summer,3.6,No,Store Pickup,0,No,38.0,Venmo,Monthly,2303.0,view,2023-08-10,10:00:00,RoomMates Pokemon Pikachu Peel And Stick Wall Decals - RMK2536GM,Y
2304.0,51.0,Male,Sunglasses,Accessories,71.0,New Jersey,S,Beige,Spring,4.8,No,2-Day Shipping,0,No,31.0,Credit Card,Fortnightly,2304.0,like,2023-08-11,10:00:00,Kid Galaxy Squeezable Pull Back School Bus. Toddler Wind Up Toy for Kids Age 2 and Up,Y
2305.0,26.0,Male,Hoodie,Clothing,73.0,Louisiana,L,Silver,Winter,4.7,No,Free Shipping,0,No,9.0,Debit Card,Fortnightly,2305.0,purchase,2023-08-12,10:00:00,Chess/Checkers/Backgammon Set,Y
2306.0,68.0,Male,Handbag,Accessories,63.0,Maine,M,Gold,Summer,2.6,No,Free Shipping,0,No,47.0,Cash,Weekly,2306.0,purchase,2023-08-13,10:00:00,Plaid Hat Pandemic: Rapid Response,Y
2307.0,27.0,Male,Gloves,Accessories,78.0,Florida,L,Silver,Winter,3.4,No,Standard,0,No,8.0,Cash,Bi-Weekly,2307.0,view,2023-08-14,10:00:00,Futaba 8JH 2.4GHz S-FHSS 8-Channel Computer Radio System with R2008SB S.Bus-Compatible Receiver,Y
2308.0,28.0,Male,Skirt,Clothing,96.0,Missouri,L,Green,Fall,3.5,No,Next Day Air,0,No,30.0,Debit Card,Annually,2308.0,like,2023-08-15,10:00:00,KidKraft Step 'N Store - Pink,Y
2309.0,49.0,Male,Sunglasses,Accessories,81.0,North Dakota,M,Teal,Winter,3.4,No,2-Day Shipping,0,No,22.0,Bank Transfer,Quarterly,2309.0,view,2023-08-16,10:00:00,"Little Colorado Traditional Bookcase, Unfinished",Y
2310.0,70.0,Male,Dress,Clothing,95.0,Connecticut,S,Gold,Fall,5.0,No,2-Day Shipping,0,No,3.0,Bank Transfer,Quarterly,2310.0,like,2023-08-17,10:00:00,"Intelligent Design Novelty Print Ultra Soft Hypoallergenic Wrinkle Free Microfiber Animals Cute Chic Kids Teens Sheet Set Bedding, Twin Xl Size, Pink Cats 3 Piece",Y
2311.0,30.0,Male,Gloves,Accessories,68.0,Virginia,M,Cyan,Spring,4.6,No,Standard,0,No,15.0,PayPal,Monthly,2311.0,purchase,2023-08-18,10:00:00,Blaze 45 & Superflash light set,Y
2312.0,27.0,Male,Sneakers,Footwear,28.0,Montana,L,Gold,Spring,4.8,No,2-Day Shipping,0,No,10.0,Bank Transfer,Every 3 Months,2312.0,view,2023-08-19,10:00:00,"Crayola Cardstock Paper, Colored Cardstock, 25 Count",Y
2313.0,19.0,Male,T-shirt,Clothing,30.0,Vermont,L,Violet,Summer,3.7,No,Free Shipping,0,No,19.0,Cash,Every 3 Months,2313.0,like,2023-08-20,10:00:00,"Swing Set Stuff Commercial Rubber Belt Seat with SSS Logo Sticker, Yellow",Y
2314.0,64.0,Male,Dress,Clothing,31.0,Georgia,M,Black,Summer,4.7,No,Next Day Air,0,No,36.0,Bank Transfer,Fortnightly,2314.0,view,2023-08-21,10:00:00,"Beistle 44130 Easter Basket and Friends Clings Sheet for Parties, 12 by 17-Inch",Y
2315.0,42.0,Male,Handbag,Accessories,95.0,Virginia,XL,Brown,Winter,4.4,No,Express,0,No,12.0,Bank Transfer,Every 3 Months,2315.0,like,2023-08-22,10:00:00,"Humbrol Acrylic Spray Matt Shade 30 Paint Model Kit, 150ml, Dark Green",Y
2316.0,69.0,Male,Socks,Clothing,79.0,Vermont,M,Indigo,Winter,3.5,No,2-Day Shipping,0,No,49.0,Debit Card,Quarterly,2316.0,like,2023-08-23,10:00:00,"Unique How to Train Your Dragon Party Stickers, 1 Pack",Y
2317.0,28.0,Male,Sneakers,Footwear,39.0,Montana,L,Yellow,Winter,3.8,No,Standard,0,No,7.0,Debit Card,Annually,2317.0,purchase,2023-08-24,10:00:00,Indian Warrior Boy's Costume,Y
2318.0,47.0,Male,Jacket,Outerwear,34.0,New Jersey,M,Purple,Summer,4.7,No,Next Day Air,0,No,28.0,Bank Transfer,Monthly,2318.0,view,2023-08-25,10:00:00,Learning Resources Canadian Currency-X-Change,Y
2319.0,69.0,Male,Hoodie,Clothing,28.0,Wyoming,L,White,Spring,3.1,No,Store Pickup,0,No,30.0,Credit Card,Annually,2319.0,like,2023-08-26,10:00:00,"Bachmann Trains EMD SD40-2 Dcc Ready Diesel Locomotive Norfolk Southern #6160 (Thoroughbred) - HO Scale, Prototypical Black",Y
2320.0,56.0,Male,Sandals,Footwear,38.0,Maine,XL,Turquoise,Winter,5.0,No,Free Shipping,0,No,29.0,PayPal,Monthly,2320.0,purchase,2023-08-27,10:00:00,Disney Bendon Cars 3 32-Page Giant Sticker Activity Book (73235),Y
2321.0,28.0,Male,Shoes,Footwear,55.0,New Mexico,M,Olive,Spring,3.7,No,Free Shipping,0,No,9.0,Debit Card,Every 3 Months,2321.0,purchase,2023-08-28,10:00:00,"INOVART Kneaded Erasers Medium Size 1-1/4"" x 3/4"" x 1/4"" - 12 Per Package",Y
2322.0,50.0,Male,Sandals,Footwear,31.0,Colorado,M,Beige,Winter,3.0,No,Next Day Air,0,No,27.0,Debit Card,Fortnightly,2322.0,view,2023-08-29,10:00:00,"Epic Skates Epic Allure Light-Up Quad Roller Skates, White",Y
2323.0,39.0,Male,Coat,Outerwear,84.0,Connecticut,S,Lavender,Spring,4.5,No,Store Pickup,0,No,21.0,Venmo,Fortnightly,2323.0,like,2023-08-30,10:00:00,Angeles Toddler White Cot Sheet,Y
2324.0,35.0,Male,Gloves,Accessories,93.0,Maryland,L,White,Winter,4.7,No,Express,0,No,36.0,Credit Card,Monthly,2324.0,view,2023-08-31,10:00:00,"Disguise Lego Construction Worker Deluxe Costume, Orange, Medium (7-8)",Y
2325.0,59.0,Male,Coat,Outerwear,28.0,Oregon,L,Brown,Winter,3.5,No,Free Shipping,0,No,19.0,Debit Card,Annually,2325.0,like,2023-09-01,10:00:00,Ken Fashionistas Doll with Long Blonde Hair,Y
2326.0,44.0,Male,Boots,Footwear,55.0,New York,M,Charcoal,Summer,4.4,No,2-Day Shipping,0,No,47.0,Cash,Weekly,2326.0,like,2023-09-02,10:00:00,Quiksilver Little Chompine Boys Backpack,Y
2327.0,66.0,Male,Skirt,Clothing,63.0,Oklahoma,L,Maroon,Winter,2.6,No,Standard,0,No,38.0,Bank Transfer,Annually,2327.0,purchase,2023-09-03,10:00:00,"Losi 1/10 2.2 Rock Rey 4WD RC Rock Racer Brushless RTR with AVC and 2800Kv Brushless Power System (Battery and Charger Not Included): LOS03009T1, Yellow",Y
2328.0,20.0,Male,Skirt,Clothing,94.0,Alabama,M,Red,Winter,4.2,No,2-Day Shipping,0,No,22.0,Venmo,Bi-Weekly,2328.0,view,2023-09-04,10:00:00,"Party Essentials ValuMost Printed Plastic Table Cover Available in 36 Colors, 54"" x 108"", Happy Birthday",Y
2329.0,45.0,Male,Pants,Clothing,36.0,North Dakota,M,Maroon,Fall,2.6,No,Express,0,No,29.0,Venmo,Bi-Weekly,2329.0,like,2023-09-05,10:00:00,Didax Educational Resources Write On/Wipe Off 120 Number Mats (10 Pack),Y
2330.0,49.0,Male,Hat,Accessories,97.0,Nebraska,S,Teal,Spring,4.8,No,Free Shipping,0,No,42.0,Bank Transfer,Annually,2330.0,purchase,2023-09-06,10:00:00,"MOLUK Nigi, Nagi, Nogi - Primary Colors",Y
2331.0,60.0,Male,Backpack,Accessories,63.0,Arizona,L,Orange,Summer,2.9,No,Store Pickup,0,No,47.0,PayPal,Every 3 Months,2331.0,purchase,2023-09-07,10:00:00,Bloody Eyeballs | Halloween Decor,Y
2332.0,61.0,Male,Scarf,Accessories,77.0,Illinois,S,Olive,Spring,4.3,No,2-Day Shipping,0,No,10.0,Credit Card,Bi-Weekly,2332.0,purchase,2023-09-08,10:00:00,Orange Rouge Fate/Grand Order: Caster/Gilgamesh 1: 8 Scale PVC Figure,Y
2333.0,36.0,Male,Scarf,Accessories,53.0,South Carolina,XL,Olive,Fall,2.6,No,Store Pickup,0,No,10.0,Venmo,Monthly,2333.0,view,2023-09-09,10:00:00,American Greetings Finding Dory Lunch Napkins (16 Count),Y
2334.0,33.0,Male,Shirt,Clothing,77.0,Kansas,M,Beige,Spring,3.8,No,Next Day Air,0,No,1.0,PayPal,Every 3 Months,2334.0,like,2023-09-10,10:00:00,"Unique Party 56849 - 12"" Latex Blush Pink Balloons, Pack of 50",Y
2335.0,49.0,Male,Boots,Footwear,79.0,Kansas,L,Green,Summer,4.2,No,Standard,0,No,7.0,Credit Card,Monthly,2335.0,view,2023-09-11,10:00:00,Sax True Flow Water Soluble Block Printing Ink - 16 Ounces - Gold,Y
2336.0,31.0,Male,Coat,Outerwear,37.0,Idaho,M,Black,Summer,3.9,No,Store Pickup,0,No,10.0,Venmo,Fortnightly,2336.0,like,2023-09-12,10:00:00,"ARRMA Dboots Hoons 42/100 2.9 Belted Rc Tires with Foam Inserts, Mounted On 5-Spoke Black Wheels (Set of 2): ARA55062",Y
2337.0,19.0,Male,Belt,Accessories,94.0,California,M,Green,Winter,3.1,No,Free Shipping,0,No,11.0,Credit Card,Weekly,2337.0,like,2023-09-13,10:00:00,"amscan Valentine's Day Plastic Puzzle Cube Party Toy Favor Set (1 Piece), 1 1/8"" x 1 1/8"" x 1 1/8"", Multicolor",Y
2338.0,39.0,Male,Boots,Footwear,76.0,North Dakota,S,Violet,Fall,3.6,No,Store Pickup,0,No,5.0,Cash,Annually,2338.0,purchase,2023-09-14,10:00:00,Bachmann Trains Southern Quad Hopper,Y
2339.0,66.0,Male,Sneakers,Footwear,68.0,Georgia,S,Silver,Fall,4.0,No,Express,0,No,21.0,PayPal,Quarterly,2339.0,view,2023-09-15,10:00:00,Rubie's Marvel Super Hero Adventures Toddler Muscle Chest Costume,Y
2340.0,25.0,Male,Shirt,Clothing,65.0,Illinois,L,Maroon,Spring,3.4,No,Next Day Air,0,No,24.0,Bank Transfer,Quarterly,2340.0,like,2023-09-16,10:00:00,Marvel's Guardians Of The Galaxy Ring – 9,Y
2341.0,63.0,Male,Blouse,Clothing,24.0,Delaware,M,Cyan,Summer,2.6,No,Standard,0,No,37.0,Credit Card,Fortnightly,2341.0,purchase,2023-09-17,10:00:00,"Little Kids Fubbles Bubble Blastin’ Bigger Bubbles Kids Automatic Party Machine and Includes 4oz of Bubble Solution Toy, Pink",Y
2342.0,56.0,Male,Jacket,Outerwear,31.0,Connecticut,L,Teal,Summer,4.5,No,Express,0,No,22.0,Venmo,Every 3 Months,2342.0,purchase,2023-09-18,10:00:00,Walthers Cornerstone Hole-In-One Donut Shop Train,Y
